{
 "meta": {
  "schema_version": "1.0.0",
  "product": "feasibility_report",
  "tier": "desk",
  "report_id": "FR-20261019-C6TAG",
  "title": "Feasibility Report: C6 Road commercial lot, Calzada–Tipas, Taguig",
  "subject": {
   "name": "C6 Road commercial lot, Calzada–Tipas",
   "address": "C6 Road (Laguna Lake Highway)",
   "city_municipality": "Taguig",
   "province": "Metro Manila",
   "intended_use": "industrial_warehouse",
   "barangay": "Calzada-Tipas",
   "region": "NCR",
   "lot_area": {
    "value": 14323,
    "range": null,
    "unit": "sqm",
    "as_of": null,
    "status": "to_be_confirmed",
    "source_ids": [
     "S-001"
    ],
    "note": "As entered; confirm against title and survey."
   },
   "intended_use_detail": "Dry warehouse"
  },
  "inputs_provided": {
   "level": "L3_plus_cost_and_funding",
   "items": [
    {
     "key": "location",
     "provided": true
    },
    {
     "key": "lot_area",
     "provided": true
    },
    {
     "key": "intended_use",
     "provided": true
    },
    {
     "key": "owner_developer_profile",
     "provided": true
    },
    {
     "key": "goals_objectives",
     "provided": true
    },
    {
     "key": "title_documents",
     "provided": true
    },
    {
     "key": "tax_declaration",
     "provided": true
    },
    {
     "key": "zoning_certificate",
     "provided": false
    },
    {
     "key": "site_survey",
     "provided": false
    },
    {
     "key": "geotechnical_report",
     "provided": false
    },
    {
     "key": "environmental_permits",
     "provided": false
    },
    {
     "key": "unit_mix_and_pricing",
     "provided": true
    },
    {
     "key": "development_cost",
     "provided": true
    },
    {
     "key": "land_cost",
     "provided": true
    },
    {
     "key": "funding_structure",
     "provided": true
    },
    {
     "key": "operating_assumptions",
     "provided": true
    },
    {
     "key": "timeline",
     "provided": true
    }
   ]
  },
  "prepared_for": "Mock client (fictional): Dalisay Logistics Holdings, Inc.",
  "prepared_by": "GRID Property Ventures · Feasibility Studio",
  "generated_at": "2026-10-19T02:00:00.000Z",
  "as_of": "2026-10-19",
  "locale": "en-PH",
  "currency": "PHP",
  "run": {
   "run_id": "run-FR-20261019-H5SNPM",
   "dag_id": "grid.feasibility_report",
   "dag_version": "0.1.0",
   "nodes": [
    {
     "node_id": "N00_intake",
     "model": "prototype",
     "status": "succeeded"
    },
    {
     "node_id": "N01_input_gate",
     "model": "prototype",
     "status": "succeeded"
    },
    {
     "node_id": "N02_planner",
     "model": "prototype",
     "status": "succeeded"
    },
    {
     "node_id": "N03_doc_extract",
     "model": "not connected (prototype)",
     "status": "succeeded"
    },
    {
     "node_id": "N04_r_location",
     "model": "not connected (prototype)",
     "status": "succeeded"
    },
    {
     "node_id": "N05_r_market",
     "model": "not connected (prototype)",
     "status": "succeeded"
    },
    {
     "node_id": "N06_r_technical",
     "model": "not connected (prototype)",
     "status": "succeeded"
    },
    {
     "node_id": "N07_r_socio",
     "model": "not connected (prototype)",
     "status": "succeeded"
    },
    {
     "node_id": "N08_r_environment",
     "model": "not connected (prototype)",
     "status": "succeeded"
    },
    {
     "node_id": "N09_r_developer",
     "model": "not connected (prototype)",
     "status": "succeeded"
    },
    {
     "node_id": "N10_evidence_merge",
     "model": "prototype",
     "status": "succeeded"
    },
    {
     "node_id": "N11_fact_check",
     "model": "not connected (prototype)",
     "status": "succeeded"
    },
    {
     "node_id": "N12_finance_engine",
     "model": "prototype",
     "status": "succeeded"
    },
    {
     "node_id": "N13_section_writers",
     "model": "prototype",
     "status": "succeeded"
    },
    {
     "node_id": "N14_scoring",
     "model": "prototype",
     "status": "succeeded"
    },
    {
     "node_id": "N15_findings",
     "model": "prototype",
     "status": "succeeded"
    },
    {
     "node_id": "N16_qa_critic",
     "model": "prototype",
     "status": "succeeded"
    },
    {
     "node_id": "N17_exec_summary",
     "model": "prototype",
     "status": "succeeded"
    },
    {
     "node_id": "N18_assembler",
     "model": "prototype",
     "status": "succeeded"
    },
    {
     "node_id": "N19_human_review",
     "model": "prototype",
     "status": "succeeded"
    },
    {
     "node_id": "N20_publish",
     "model": "prototype",
     "status": "succeeded"
    }
   ]
  },
  "review": {
   "status": "approved",
   "reviewer": "GRID research team (mock)",
   "reviewed_at": "2026-10-19T09:00:00+08:00"
  },
  "disclaimer": "MOCK REPORT for demonstration. Market facts are real public listings and sources as of 19 October 2026; the client, its project concept and its financial assumptions are fictional. Not a licensed appraisal, engineering, legal, tax or investment opinion. Asking prices are not closed sales."
 },
 "front_matter": {
  "cover": {
   "title": "Feasibility Report: C6 Road commercial lot, Calzada–Tipas, Taguig",
   "subtitle": "Leased dry-warehouse concept · Calzada–Tipas, Taguig City",
   "date": "2026-10-19",
   "hero_image": null
  },
  "executive_summary": {
   "meta": {
    "schema_version": "1.0.0",
    "product": "executive_summary",
    "tier": "desk",
    "report_id": "ES-20261019-C6TAG",
    "title": "Executive Summary: C6 Road commercial lot, Calzada–Tipas, Taguig",
    "subject": {
     "name": "C6 Road commercial lot, Calzada–Tipas",
     "address": "C6 Road (Laguna Lake Highway)",
     "city_municipality": "Taguig",
     "province": "Metro Manila",
     "intended_use": "industrial_warehouse",
     "barangay": "Calzada-Tipas",
     "region": "NCR",
     "lot_area": {
      "value": 14323,
      "range": null,
      "unit": "sqm",
      "as_of": null,
      "status": "to_be_confirmed",
      "source_ids": [
       "S-001"
      ],
      "note": "As entered; confirm against title and survey."
     },
     "intended_use_detail": "Dry warehouse"
    },
    "inputs_provided": {
     "level": "L3_plus_cost_and_funding",
     "items": [
      {
       "key": "location",
       "provided": true
      },
      {
       "key": "lot_area",
       "provided": true
      },
      {
       "key": "intended_use",
       "provided": true
      },
      {
       "key": "owner_developer_profile",
       "provided": true
      },
      {
       "key": "goals_objectives",
       "provided": true
      },
      {
       "key": "title_documents",
       "provided": true
      },
      {
       "key": "tax_declaration",
       "provided": true
      },
      {
       "key": "zoning_certificate",
       "provided": false
      },
      {
       "key": "site_survey",
       "provided": false
      },
      {
       "key": "geotechnical_report",
       "provided": false
      },
      {
       "key": "environmental_permits",
       "provided": false
      },
      {
       "key": "unit_mix_and_pricing",
       "provided": true
      },
      {
       "key": "development_cost",
       "provided": true
      },
      {
       "key": "land_cost",
       "provided": true
      },
      {
       "key": "funding_structure",
       "provided": true
      },
      {
       "key": "operating_assumptions",
       "provided": true
      },
      {
       "key": "timeline",
       "provided": true
      }
     ]
    },
    "prepared_for": "Mock client (fictional): Dalisay Logistics Holdings, Inc.",
    "prepared_by": "GRID Property Ventures · Feasibility Studio",
    "generated_at": "2026-10-19T02:00:00.000Z",
    "as_of": "2026-10-19",
    "locale": "en-PH",
    "currency": "PHP",
    "run": {
     "run_id": "run-FR-20261019-H5SNPM",
     "dag_id": "grid.feasibility_report",
     "dag_version": "0.1.0",
     "nodes": [
      {
       "node_id": "N00_intake",
       "model": "prototype",
       "status": "succeeded"
      },
      {
       "node_id": "N01_input_gate",
       "model": "prototype",
       "status": "succeeded"
      },
      {
       "node_id": "N02_planner",
       "model": "prototype",
       "status": "succeeded"
      },
      {
       "node_id": "N03_doc_extract",
       "model": "not connected (prototype)",
       "status": "succeeded"
      },
      {
       "node_id": "N04_r_location",
       "model": "not connected (prototype)",
       "status": "succeeded"
      },
      {
       "node_id": "N05_r_market",
       "model": "not connected (prototype)",
       "status": "succeeded"
      },
      {
       "node_id": "N06_r_technical",
       "model": "not connected (prototype)",
       "status": "succeeded"
      },
      {
       "node_id": "N07_r_socio",
       "model": "not connected (prototype)",
       "status": "succeeded"
      },
      {
       "node_id": "N08_r_environment",
       "model": "not connected (prototype)",
       "status": "succeeded"
      },
      {
       "node_id": "N09_r_developer",
       "model": "not connected (prototype)",
       "status": "succeeded"
      },
      {
       "node_id": "N10_evidence_merge",
       "model": "prototype",
       "status": "succeeded"
      },
      {
       "node_id": "N11_fact_check",
       "model": "not connected (prototype)",
       "status": "succeeded"
      },
      {
       "node_id": "N12_finance_engine",
       "model": "prototype",
       "status": "succeeded"
      },
      {
       "node_id": "N13_section_writers",
       "model": "prototype",
       "status": "succeeded"
      },
      {
       "node_id": "N14_scoring",
       "model": "prototype",
       "status": "succeeded"
      },
      {
       "node_id": "N15_findings",
       "model": "prototype",
       "status": "succeeded"
      },
      {
       "node_id": "N16_qa_critic",
       "model": "prototype",
       "status": "succeeded"
      },
      {
       "node_id": "N17_exec_summary",